{
  "module": "locomotion",
  "system_module": "locomotion",
  "version": "1.0",
  "rubric_version": "1.1",
  "overview": "Roblox hands every game the stock Animate script — one forward walk/run loop swapped by WalkSpeed — and that IS the generic mean this rubric is built to beat. The whole guide therefore pivots on one decision made FIRST: stop swapping clips and instead OWN a runtime control layer that reads live planar velocity each frame and weight-blends multiple authored clips. You author the clips as flip-book keyposes on a Motor6D rig (spawn_rig + pose_joint/ik_reach + add_keyframe), then write the velocity-driven controller, foot IK, additive aim/lean, momentum tracking, and marker-synced events as runtime Luau via run_luau, verifying every layer visually with capture/capture_animation. Baseline = an owned velocity-classifying controller with a distinct idle@0 node. Good = the killer systems (2D speed+direction blend tree, foot IK, additive look-at) plus stride-lock, directional set, per-region shaping, and velocity-weighted transitions. Exceptional = gait-phase pelvis sway, additive velocity lean, marker-synced FX, runtime momentum, terrain hip-height, a named personality posture, and rig-portable signal-driven computation.",
  "killer_systems": [
    {
      "name": "Blend Tree (speed + direction)",
      "what": "A velocity-driven 2D blend space: a speed axis (idle@0 -> walk -> jog -> run) that crossfades adjacent tiers, AND a direction axis (forward/back + strafe, diagonals ideal) whose weights come from velocity projected into the rig's local frame. Replaces the stock hard clip-swap and the moonwalk.",
      "how": "Author the idle/walk/jog/run + forward/back/left/right clips as separate looped Movement-priority clips with add_keyframe (one clip per direction+speed). In a run_luau-written controller script bound under StarterCharacterScripts (named 'Animate' so it overrides the default), Animator:LoadAnimation every clip and Play() them all at weight 0. Each frame on RunService.PreSimulation compute localVel = HRP.CFrame:VectorToObjectSpace(HRP.AssemblyLinearVelocity); derive per-direction weights by clamping localVel.X/localVel.Z against WalkSpeed (X=strafe, Z=fwd/back), and a speed-axis blend factor = speed/WalkSpeed; drive each track with AnimationTrack:AdjustWeight(w) (clamp to a tiny Epsilon, never exactly 0, so tracks keep replicating to other clients) and AdjustSpeed(speed/clipBaseSpeed). All directional tracks MUST be the same Movement priority so the Animator combines them by weight."
    },
    {
      "name": "Foot IK (terrain grounding)",
      "what": "Runtime inverse kinematics that plants each foot on the actual ground, slopes, and steps — layered OVER the playing locomotion clip (the clip carries style, the IK corrects to the world), so no skating and no floating.",
      "how": "Per leg, run_luau to create an IKControl parented to the Humanoid with Type=Enum.IKControlType.Transform, ChainRoot=LeftUpperLeg, EndEffector=LeftFoot, Target=an Attachment you move each frame, Weight=1, SmoothTime~0.2. Each frame while grounded, raycast downward from above/from the animated hip with workspace:Raycast; set Target.WorldCFrame to the hit point rotated to the surface normal via CFrame.lookAt(hit.Position, hit.Position + hit.Normal) so the foot tilts on slopes; reject surfaces past ~45 degrees; disable IK on jump/fall. For anti-skate, FREEZE the stance foot's target at its plant world-position through the contact phase and re-target on lift-off. The IKControl runs in the Animator's IK pass, composing on the clip automatically."
    },
    {
      "name": "Additive Look-At / Aim",
      "what": "An upper-body aim/look-at layer that rides ON TOP of the running gait — head/torso/arms orient to a target while the legs keep walking — never stopping or replacing the locomotion track.",
      "how": "Two routes. (1) Priority route: play the aim clip at Action priority over Movement-priority locomotion so only the conflicting upper-body limbs are overridden. (2) Procedural route (no shipped additive API): in a run_luau script bound to RunService.PreSimulation (AFTER the Animator evaluates), POST-MULTIPLY an aim CFrame onto Waist.Transform and Neck.Transform — Waist.Transform = Waist.Transform * CFrame.Angles(-pitch, yaw, 0) — using math.atan for pitch to the target. Use Motor6D.Transform (NOT C0), keep it to UpperTorso/Head/UpperArms only so legs stay locomotion-driven, and never Stop() the walk track."
    },
    {
      "name": "Pelvis Bias / Hip Sway (gait phase)",
      "what": "The pelvis counter-rotates against the legs and sways side-to-side tied to gait phase (figure-8 hip trace), on R15 via the LowerTorso joint — and the run is re-posed (wider split, deeper drop, an airborne frame, arms in and slightly behind the legs) rather than a sped-up walk.",
      "how": "Re-author the run clip distinctly from the walk with add_keyframe (don't reuse the walk faster). For the sway, in the controller (run_luau) drive a small sinusoidal X/Z offset on LowerTorso.Transform off the clip's normalized time (track.TimePosition / track.Length) so the pelvis bobs in phase with footfalls, plus an acceleration-reactive counter-rotation; apply post-Animator on .Transform onto the cached base so it doesn't accumulate."
    }
  ],
  "common_pitfalls": [
    "Leaving the stock Animate untouched and only swapping clip IDs in animTable — that is the generic floor the rubric scores as FAIL on the architecture criteria (loco-state-machine, loco-fadetime-transitions, loco-retarget-rig-portability). An ID-swap is fine to bootstrap, but you must OWN a velocity-driven controller to pass.",
    "Authoring clips on the wrong rig type. Always spawn_rig an R15 rig (R15's LowerTorso/UpperTorso split is required for hip sway and additive aim) and match the runtime rig — an R6 clip does not map onto R15 joints.",
    "Driving locomotion off Humanoid.Running (it fires ONLY on input change, so direction-switches freeze mid-strafe). Poll AssemblyLinearVelocity every frame on RunService.PreSimulation/Heartbeat instead.",
    "Mixing AnimationPriority across the directional blend tracks. All directional/speed blend clips MUST be the same Movement priority so the Animator combines them by weight; a higher-priority track fully wins and kills the blend. Author locomotion at Movement, additive aim at Action.",
    "Letting a blend weight hit exactly 0. Roblox stops replicating a track at weight 0, so other clients see frozen/wrong locomotion (invisible in solo test). Clamp every weight to a tiny Epsilon.",
    "Writing procedural aim/lean/sway on RenderStepped/PreAnimation or via Motor6D.C0 — the Animator overwrites Motor6D.Transform every frame between PreAnimation and PreSimulation, so your offset gets stomped (PreAnimation) or stacks confusingly (C0). Bind AFTER PreSimulation and POST-MULTIPLY onto .Transform (= Transform * offset), onto a CACHED base so it doesn't drift.",
    "Forgetting seamless loops and correct config on authored clips: identical first/last keyframe (copy keyframe 0 to the end), Looping ON, priority Movement (Idle for idle). A non-looping or mismatched-loop clip hitches every cycle.",
    "Mismatching AdjustSpeed's nominal/base-speed constant to the clip's authored cadence — feet still skate even with speed-sync on. Author each clip for one reference WalkSpeed and use AdjustSpeed(liveSpeed / referenceSpeed).",
    "Rig Model scaled below 1 causes persistent foot sliding no animation tweak can fix — verify the rig's scale is 1 before blaming the animation.",
    "Solo-testing only forward motion. The strafe-inversion (right/left swap + negative speed when backpedaling) and the weight=0 replication bug only show under backward/diagonal movement and on OTHER clients — drive all 8 directions and verify with a second client."
  ],
  "tiers": [
    {
      "tier": "baseline",
      "goal": "An owned, velocity-classifying control layer drives locomotion (not the stock single-loop swap), with a distinct idle@0 node — the architectural seam every later killer system composes onto.",
      "steps": [
        {
          "id": "loco-base-1-spawn-rig",
          "order_index": 1,
          "instruction": "spawn_rig an R15 Motor6D rig AS the substrate for a build-owned, velocity-driven locomotion routing layer — and in the same step commit to that architecture, not just the rig. After spawning, confirm via get_rig that the rig is R15 with a Humanoid + HumanoidRootPart AND that it exposes the LowerTorso/UpperTorso joint split (the seam hip-sway and additive-aim later compose onto) and Motor6D.Transform on the joints (the flip-book authoring channel). Then state the routing commitment the rig exists to serve: locomotion clip selection/weighting will be a function of LIVE planar velocity (and/or Humanoid MoveDirection) feeding MORE THAN ONE locomotion target through a controller the build owns (a velocity-keyed blend space or a custom Animate-override), explicitly NOT a discrete WalkSpeed-keyed swap of one forward clip on the untouched stock Animate. Name the runtime rig type you will author to match (R15 Motor6D) so the authored clips map joints correctly at runtime. Reject the step if it only spawns/confirms the rig without committing to the owned velocity-driven routing layer it is being authored against.",
          "addresses_criteria": [
            "loco-state-machine"
          ],
          "tools": [
            "spawn_rig",
            "get_rig"
          ],
          "pitfalls": "Authoring on R6 (or a mismatched runtime rig) means clips won't map joints correctly; R6 also lacks the LowerTorso split, blocking the exceptional hip-sway tier. Always author R15 and match the runtime rig type."
        },
        {
          "id": "loco-base-2-author-idle",
          "order_index": 2,